{
  "artifact": "round_hashes",
  "schema_version": "0.1",
  "thread": "thr-example-crosscheck",
  "round": 1,
  "ask_card": "r1_ask_simulation.json",
  "source": {
    "path": "contracts/examples/result.json",
    "card_id": "result-mic-20260917-001-r1",
    "revision": 1,
    "sha256": "sha256:2e8b3d47892f395fd4792a0ade25f3ce10e034ff425301f16e3ae55832848a81"
  },
  "payload_sha256": "sha256:2e8b3d47892f395fd4792a0ade25f3ce10e034ff425301f16e3ae55832848a81",
  "verified_at": "2026-09-17T10:20:00Z",
  "note": "In the real tree the source path is the sender's own questions/<qid>/result.json; here it is the hand-written example card the round carries."
}
